Category,Title,State,Year,Date,Description
Arrests,"Madhya Pradesh professor jailed, sacked for post on WhatsApp",Maharashtra,2025,4/28/2025,"Arrrests – Others
A guest lecturer at a private university in Madhya Pradesh’s Dindori, 465km from Bhopal, has been sacked after being remanded in jail over a social media post in connection with the Pahalgam attack.
Naseem Bano had posted a video of Mata Sita’s abduction in a WhatsApp group for colleagues, and a status on the terror strike, police said.
On the night of April 24, after Hindu outfits staged a protest at Kotwali police station demanding action against Bano for ‘inciting religious sentiments’, police registered an FIR against her. On May 1, the college got an official copy of the order to sack her.
Read More
Akshay Sawant, a PhD scholar from IIT Bombay, suspended on April 28 for allegedly giving unauthorised interviews to the media"
Censorship – Academia,"Akshay Sawant, a PhD scholar from the Department of Humanities and Social Sciences at the Indian Institute of Technology (IIT) Bombay. The student was suspended on April 28 until December 31, for allegedly giving unauthorised interviews to the media.",,,,
Lawfare,Political content creator Shamita Yadav booked for questioning govt on Pahalgam attack,Uttar Pradesh,2025,4/28/2025,
"Lawfare – General, Others","Social media political commentators, Shamita Yadav, known as ‘Ranting Gola’, and Lucknow University professor Dr Madri Kakoti, also known as ‘Dr Medusa’, are facing legal action over the recent posts concerning the Pahalgam terror attack. While a police complaint has been filed against Yadav, Dr Kakoti faces a sedition case",,,,
Lawfare,"FIR against Neha Singh Rathore, booked over ‘provocative’ Pahalgam attack posts",Uttar Pradesh,2025,4/28/2025,
"Lawfare – General, Others",An FIR was registered on Sunday against folk singer Neha Singh Rathore at a police station in Uttar Pradesh’s Lucknow for sharing “objectionable” content on social media regarding the recent Pahalgam terrorist attack that killed 26 people.,,,,
Censorship,17 Cuts Planned In L2 Empuraan After Gujarat Riots References Spark Row,Applicable Across India,2025,3/30/2025,
Censorship – The Arts | Self-Censorship,"Gokulam Gopalan, the producer, had earlier said the film had cleared the Censor and that the cuts were being made so that the sentiments of a section of people would not be hurt.",,,,
Censorship,’Against Indian Values’: Rajasthan Govt-Run Art Centre Cancels Queer-Themed Dance Show After RSS Objects,Rajasthan,2025,4/26/2025,
Censorship – The Arts,"Sanskar Bharati, RSS’s cultural wing, said in its letter that the event encouraged a rebellious attitude towards Indian traditional beliefs and societal systems.",,,,
Censorship,Hindutva Watch ‘X’ account suspended,Maharashtra,2025,4/25/2025,
Censorship – News Media / Documentaries,"Social media accounts of Hindutvawatch, the group that monitors hate speech by the Hindu far right, were suspended after a post about a meeting by a far-right speaker inciting violence against Muslims. The speaker had urged Hindus to beat secular people instead of “Abdul friends”. He blamed Muslims for communal violence in Nagpur and Nashik and demanded a social and economic boycott, claiming money given to Muslims is used against Hindus, continued demonising Muslims and repeated the call for an economic boycott.",,,,
Censorship,‘Posts will be blocked even if you…’: Reddit users complain after moderators ban them for posting about Pahalgam attack,Applicable Across India,2025,4/24/2025,
Censorship – Social Media,"Reddit users across multiple India-focused subreddits report that moderators have been systematically removing posts and banning members who attempt to discuss the recent Pahalgam terror attack. The controversy centers on r/Delhi, where users say even basic references to the incident trigger deletions or bans under rules against “self-referential or meta discussions” and “incit[ing] drama.”",,,,
Attacks,BJP Workers Assault Journalist Rakesh Sharma Who Questioned Centre’s Security Lapse in Pahalgam,Jammu and Kashmir,2025,4/23/2025,
Attacks – Journalists,"Dainik Jagran reporter Rakesh Sharma allegedly invited the ire of BJP protesters, including party MLAs, when he and other journalists asked them about security lapses which could have led to the attack.",,,,
Censorship,130 censorship orders issued via Home’s Sahyog portal in 5 months,Applicable Across India,2025,4/22/2025,
Censorship,"These notices effectively act as content blocking orders and are sent under Section 79(3)(b) of the Information Technology Act, 2000. These fall outside Section 69(A) of the Information Technology Act, that has been commonly used to issue online censorship orders",,,,
Censorship,"Swara Bhasker says X account permanently suspended for ‘copyright violation’ over posts on assassination of Gandhi, Republic Day",Applicable Across India,2025,1/30/2025,
Censorship – Social Media,"Bollywood actor Swara Bhasker on Thursday said that her account on X (formerly Twitter) was permanently suspended.She took to Instagram to share the news, calling the decision “ridiculous and untenable.”In her post, Swara Bhasker explained that her X account was disabled over alleged copyright infringements related to two specific images.Speaking to Maktoob, Bhasker said that she is not able to access her account.“I’m not sure what is going on, but the email I’ve received claims copyright violation, which is a bizarre and ridiculous charge,” she said.",,,,
Internet Control,Cloudflare’s VPN app among half-dozen pulled from Indian app stores,Applicable Across India,2025,1/2/2025,"More than half a dozen VPN apps, including Cloudflare’s widely used 1.1.1.1, have been pulled from India’s Apple App Store and Google Play Store following intervention from government authorities, TechCrunch has learned.
The Indian Ministry of Home Affairs issued removal orders for the apps, according to a document reviewed by TechCrunch and a disclosure made by Google to Lumen, Harvard University’s database that tracks government takedown requests globally.
Among the affected apps are Hide.me and PrivadoVPN. In a communication to one of the affected developers, seen by TechCrunch, Apple cited a “demand” from the Indian Cyber Crime Coordination Centre, part of the Ministry of Home Affairs, which deemed the developer content to contravene Indian law.
Read More"
Killings,Mysterious disappearance of Bijapur journalist Mukesh Chandrakar,Chhattisgarh,2025,1/1/2025,
Killings – Journalists,"Mysterious disappearance of Bijapur journalist Mukesh Chandrakar on Jan 1, Bastar District Journalists Association demands thorough investigation.",,,,
Censorship,"DU professsor denied nod for lecture at US institute, calls it ‘censorship’",Delhi,2025,4/17/2025,
Censorship – Academia,"Delhi University professor Apoorvanand Jha, who was to participate in an academic event at The New School in New York, was asked by the DU administration to submit the text of his proposed talk before giving him clearance to attend the event. After he refused, the varsity denied him permission to travel, The Indian Express has learnt.",,,,
Censorship,"‘They think they can shut me up, but they can’t’ – India critic facing ban in homeland",Applicable Across India,2025,4/12/2025,
Harassment – Others,An Auckland doctor says she will not be silenced by the Indian government after being warned she faces a ban on returning to her homeland because of her political activities and online criticisms.,,,,
Censorship,"IISER Pune cancels talks by women academics, anti-caste activists after ABVP protest",Maharashtra,2025,4/12/2025,
Censorship – Academia,"The Akhil Bharatiya Vidyarthi Parishad approached police against inviting alleged ‘members of the extreme Left’ for the event at the Indian Institute of Science Education and Research, Pune",,,,
Censorship,"Release of ‘Phule’ Postponed After CBFC Asks Makers to Remove Caste-Based Terms, Reference to Manu",Applicable Across India,2025,4/11/2025,
Censorship – The Arts,The NCP (SP) which is part of the opposition Maha Vikas Aghadi has slammed the CBFC’s decision to order removal of the scenes from Phule.,,,,
Censorship,"YouTuber, MD Sameer, sued for Rs 10 crore over video on Karnataka temple town rape-murder case",Karnataka,2025,4/11/2025,
Censorship – The Arts,A Bengaluru court has directed YouTuber MD Sameer to delete a video and appear before it after he allegedly violated an earlier injunction related to the sensitive Dharmasthala murder case. He has been served with a court notice and a Rs 10 crore defamation lawsuit.,,,,
Internet Control,"Maharashtra Cyber issues advisories to depts on online threats; acts against Wikipedia, Proton Mail",Maharashtra,2025,4/11/2025,
Internet Control,"Maharashtra Cyber has issued advisories to various state government departments, including police, to take precautionary steps to avoid cyber attacks as the credentials of many of these departments were found on the darknet, officials said on Friday.",,,,
Lawfare,Delhi High Court orders takedown of Rajdeep Sardesai’s video for violating Shazia Ilmi’s privacy; Defamation claims partially accepted,Applicable Across India,2025,4/9/2025,
"Lawfare – Defamation, Journalists","The plaintiff is aggrieved by the incident which occurred at her residence on 26-07-2024 in the late evening, after she withdrew her participation from a live debate programme (‘live debate’) hosted by Rajdeep Sardesai premised on ‘Kargil Diwas’ and ‘Agniveers’, telecasted at 9:00 PM on India Today Television. Published on April 9, 2025By Arunima Delhi High Court Advertisement Advertisement Delhi High Court: A suit was filed by Shazia Ilmi (plaintiff) seeking to restrain them from making, publishing, circulating objectionable, offensive, ex facie false and allegedly doctored video outraging plaintiff’s modesty in the privacy of her home, followed by public statement with malicious intent, to lower the dignity of the Plaintiff and cast a slur on her temperament and character, which as per the plaintiff is defamatory. Manmeet Pritam Singh Arora, J., while the allegation of the video being doctored was not substantiated, and the Plaintiff failed to approach the Court with clean hands by suppressing relevant tweets from the conversation thread, the Plaintiff’s right to privacy was indeed violated with respect to an 18-second portion of the video as it was recorded without her consent after she had exited the live debate.",,,,
Censorship,"NCERT texts drop references to Babri Masjid, Gujarat riots, Hindutva",Applicable Across India,2025,4/5/2025,
Censorship – Academia,"Officials said the tweaks are part of a routine update, not linked to the development of new books as per the New Curriculum Framework",,,,
Censorship,Meerut professor debarred from exam duties for setting ‘objectionable’ questions on RSS,Uttar Pradesh,2025,4/5/2025,
Censorship – Academia,"Professor Seema Panwar, the HOD of the political science department at Meerut College, submitted a written apology but said the paper she set did not have any out-of-syllabus questions.",,,,
Killings,"Missing Journalist’s (Shahdeb Dey) Burned Body Found In North Andaman, 4 Arrested",Andaman and Nicobar Islands,2025,4/2/2025,
Killings – Journalists,"The body of Shahdeb Dey, the owner of a local news channel known as ‘Republic Andaman’, was found in a field from Deshbandu Nagar in Diglipur on Tuesday, police said.",,,,
Censorship,Haryana Police ban on songs promoting violence sparks controversy,Haryana,2025,3/30/2025,
Censorship – The Arts,"About 10 songs have been taken down from various social media platforms over the past fortnight, and at least two concerts, including one in Gurugram, halted midway.",,,,
Lawfare,South First journalist Sumit Jha released after being detained while covering student protest at University of Hyderabad,Telangana,2025,3/30/2025,
"Lawfare – Arrests, Journalists","South First’s journalist, Sumit Jha, who was detained by Hyderabad Police on Sunday, 30 March, while reporting on a student protest at the University of Hyderabad against the clearing of forest land marked for auction by the Telangana government, has been released.",,,,
Lawfare,FIR against journalist Zakir Ali Tyagi for tweet on Nagpur violence,Maharashtra,2025,3/28/2025,
"Lawfare – General, Journalists","According to India TV news, Nagpur police have filed an FIR against Zakir Ali Tyagi for posting content against violence. In the post, Chhava film’s producer and actor, along with Bajrang Dal and VHP, were criticized, and a video was shared. The police have categorized this as a crime and filed a case accordingly.",,,,
Attacks,Bihar: Journalist Krishnandan assaulted during election campaign in Magadh Mahila College,Bihar,2025,3/26/2025,
Attacks – Journalists,"In a shocking incident, unidentified men allegedly assaulted journalist Krishnandan inside Magadh Mahila College on Wednesday.",,,,
Censorship,"Censor board blocks release of Santosh over portrayal of police brutality, director refuses to make cuts suggested by CBFC",Applicable Across India,2025,3/26/2025,
Censorship – The Arts,"In an interview, Santosh director Sandhya Suri said that the the censor board suggested multiple cuts spanning several pages. She said it made no sense to make those changes.",,,,
Attacks,Mumbai’s Habitat Comedy Club vandalised over Kunal Kamra’s joke on Eknath Shinde,Maharashtra,2025,3/25/2025,
Attacks – Others,"Mumbai police have registered an FIR against 19-20 vandals who attacked a comedy club over a joke about Eknath Shinde by Kunal Kamra. Charges include assault on public servants, unlawful assembly, and rioting. The Habitat Comedy Club has temporarily shut down citing safety concerns.",,,,
Arrests,"Arrest of Assam journalist, Dilwar Hussain Mozumder, covering protest against bank ‘scam’ slammed",Assam,2025,3/25/2025,
Arrests – Journalists,The arrest of a digital media journalist in Assam for allegedly abusing an unnamed tribal person while trying to question the managing director of a cooperative bank over corruption charges has triggered outrage.,,,,
Censorship,X sues Modi’s government over content removal in new India censorship fight,Applicable Across India,2025,3/20/2025,
Censorship – Social Media,Elon Musk’s company is arguing against the government’s expanded powers to allow easier removal of online content,,,,
Censorship,"Star Vijay holds back Neeya Naana episode on 3-language policy, DMK alleges BJP pressure",Tamil Nadu,2025,3/16/2025,
Censorship – The Arts,Some participants in the debate told TNM that supporters of the three-language policy struggled to present strong arguments.,,,,
Internet Control,"West Bengal’s Birbhum tense after Holi clash, internet suspended; BJP slams TMC",West Bengal,2025,3/15/2025,"Internet and voice-over-internet telephony services were suspended in at least five Gram Panchayat areas of Sainthia town in West Bengal’s Birbhum.
Tensions escalated in West Bengal’s Birbhum on Saturday after violent clashes between two groups led to the suspension of the internet in parts of town. The state government also deployed a huge contingent of security forces to maintain law and order.The internet shutdown is in effect in Bengal’s Birbhum from March 14 to March 17.(PTI)
Read More"
Threats,RSS Protest against Tushar Gandhi: Five Booked,Kerala,2025,3/14/2025,
Threats – Others,"A case was registered against five people, reportedly RSS-BJP workers, on Thursday for raising slogans against Tushar Gandhi, the great-grandson of Mahatma Gandhi, demanding that he retract his statement against the saffron outfit. The case was registered under Sections 189(2), 191(2), 190, and 126(2) of the Bharatiya Nyaya Sanhita (BNS) on charges of unlawful assembly, rioting, and wrongful restraint, police said. “An investigation is underway, and no arrests have been made so far,” an official said. According to police, a small group of people, allegedly linked to the Sangh Parivar, raised slogans against Gandhi at the end of a function he attended at nearby Neyyattinkara on Wednesday evening. Visuals aired by TV channels showed a group of men raising slogans against Gandhi, urging him to withdraw his statement. Earlier, Chief Minister Pinarayi Vijayan strongly condemned the alleged “Sangh Parivar attack” on Gandhi stating that actions that suppress freedom of expression cannot be allowed in a democratic society. Gandhi had arrived in Neyyatinkara to unveil the statue of the late Gandhian, P Gopinathan Nair.",,,,
Censorship,Bengaluru court passes media gag order on defamatory remarks against Ranya Rao,Karnataka,2025,3/12/2025,
Censorship – News Media/Documentaries,"A city civil court on Wednesday passed an ex-parte interim order restraining the media from publishing or telecasting any defamatory allegations and comments against actress Harshavardini Ranya Rao, who was arrested in the gold smuggling case.",,,,
Censorship,"News outlets receive ‘threat mails’, some delete stories on concerns over Ambanis’ Vantara project",Applicable Across India,2025,3/12/2025,
Censorship – News Media/Documentaries,"Days after reporting on a South African wildlife organization raising concerns about the functioning of the Reliance-owned Vantara Animal and Rehabilitation Centre in Jamnagar, Gujarat, at least three major media outlets have taken down their stories from the web.",,,,
Censorship,"Delhi High Court Orders Take Down Of YouTuber Shyam Meera Singh’s ‘Defamatory’ Video On Sadhguru, Isha Foundation",Applicable Across India,2025,3/12/2025,
Censorship – The Arts,"The Delhi High Court on Wednesday directed the take down of YouTuber Shyam Meera Singh’s recent, allegedly defamatory YouTube video on Isha Foundation and its founder spiritual leader Sadhguru Jaggi Vasudev.The video titled “Sadhguru EXPOSED: What’s happening in Jaggi Vasudev’s Ashram” was uploaded by Singh on his YouTube channel on February 24 and he shared it on his ‘X’ page…",,,,
Arrests,‘Revanth Reddy wants to silence me’: Uproar as 2 Telangana journalists held over farmer video case,Telangana,2025,3/12/2025,
Arrests – Journalists,It’s not the first time Revathi Pogadadanda has accused the state government of targeting her.,,,,
Arrests,"YouTube channel editor, Tushar Abaji Kharat, arrested in Satara",Maharashtra,2025,3/11/2025,
Arrests – Journalists,"Tushar Abaji Kharat has been booked on charges of hurling casteist remarks against Shekhar Patole, 36, a BJP media cell functionary from Maan taluka and aide of BJP MLA Jaykumar Gore.",,,,
Arrests,"Belgian freelance photojournalist Simon Clement held in Mizoram, empty cartridges recovered from his possession",Mizoram,2025,3/10/2025,
Arrests – Journalists,"A Belgium national was arrested in Mizoram’s Aizawl after two empty cartridges were allegedly recovered from his possession, a police officer said.",,,,
Killings,"Journalist Raghavendra Bajpai killed in UP’s Sitapur: Bike hit, then shot three times on highway",Uttar Pradesh,2025,3/8/2025,
Killings – Journalists,"Reportedly, the incident happened when the assailants first rammed into his bike and then shot him three times. It was first seen as an accident but was soon turned into a murder case after doctors at a district hospital discovered three bullet wounds on his body.",,,,
Policies/Regulation,To keep tabs on news coverage: Maharashtra govt to set up media monitoring centre at Rs 10 crore,Maharashtra,2025,3/6/2025,"The Maharashtra government will set up a media monitoring centre at an estimated cost of Rs 10 crore that will monitor news coverage related to the state government in print, electronic, social and digital mediums. It will also prepare a report by analysing the coverage and bring to the notice and take action on the spread of negative or misleading news related to the state government.
“Government schemes and policies are publicised through various print, electronic, social and digital mediums. The state government was considering to initiate a media monitoring centre where these news items will be monitored and analysed under one roof,” said a Government Resolution (GR) issued on Wednesday.
Read More"
Policies/Regulation,"New income tax bill proposes allowing officers access to your email, social media",Applicable Across India,2025,3/5/2025,"The new bill gives tax officers the authority to access computers, emails, and social media accounts, raising privacy concerns.
Tax officers can access your emails and social media, etc. from next year
The new bill allows overriding passwords and security codes
Experts are concerned about misuse of power and privacy invasion
The new income tax bill has recently been in the news, and not for the reasons taxpayers would hope. While the government said it’s all about simplifying tax laws, buried within the bill is a provision that hands sweeping powers to tax authorities allowing them to dig through emails, trading accounts, social media profiles, and more during tax investigations.
Finance Minister Nirmala Sitharaman introduced the revamped Income Tax Bill, 2025, in Parliament, calling it an overhaul of the six-decade-old tax framework. But before it becomes law, a select committee will review it. And the key concern is a clause that expands the scope of tax searches beyond what’s currently allowed to include “virtual digital spaces”
Right now, tax officers can ask for access to laptops, hard drives, and emails, but since the current tax law doesn’t explicitly mention digital records, such demands often face legal pushback. However, the new bill makes it clear: tax authorities can demand access to digital assets, and if a taxpayer refuses, they can bypass passwords, override security settings, and unlock files.
Read More"
Threats,"‘The idea is to threaten someone telling the truth’, says Konkani writer Uday Bhembre after Bajrang Dal protests his remarks on Shivaji",Goa,2025,2/28/2025,
Threats – Others,"The protesters, who had previously burnt Bhembre’s effigy, dispersed after a brief argument with the writer’s son and his friends.",,,,
Censorship,DUJ seeks press access to Delhi Assembly,Delhi,2025,2/27/2025,
Censorship – News Media/Documentaries,"The Delhi Union of Journalists (DUJ) has expressed strong disapproval regarding the recent actions of the newly inaugurated Bharatiya Janata Party (BJP) government in Delhi, which sought to restrict access for specific reporters to the Assembly for coverage. On February 24, 2025, the first day of the new session, three journalists from ANI, ABP News, and PTI were stopped at the Assembly gates. The next day, five journalists from Times Now, Navbharat, News Nation, News18, Zee News, and Jantantra were also denied entry. After their colleagues raised concerns, some of these journalists were eventually allowed inside. The Speaker’s office later attributed the incident to a miscommunication.",,,,
Threats,"Historian Indrajit Sawant’s criticism of Chhava reignites Brahmin-Maratha row, says he was ‘abused, threatened’",Maharashtra,2025,2/25/2025,
Threats – Others,"Bollywood movie Chhaava, based on the life of Maratha king Chhatrapati Sambhaji, is climbing new heights at the box office but has flared up a controversy in Maharashtra. A historian of the Maratha period said he was threatened and received caste-based abuse for challenging certain facts in the movie.",,,,
Censorship,Kuki group condemns scholar Dr. Seilen Haokip’s exclusion from DU Literature Festival,Delhi,2025,2/24/2025,
Censorship – Academia,"The Kuki Students’ Organisation, Delhi & NCR (KSOD & NCR) has strongly condemned the unjust and politically motivated exclusion of Dr. Seilen Haokip from the Delhi University Literature Festival 2025.",,,,
Censorship,Jio Hotstar OTT Faces Backlash for Censoring HBO Shows,Applicable Across India,2025,2/22/2025,
Censorship – The Arts,"Jio Hotstar’s handling of HBO content in India has triggered massive backlash, with viewers accusing the platform of excessive censorship and content manipulation. Many users have taken to social media, frustrated that HBO’s original programming is either missing, altered, or heavily censored. Some claim India now lacks an official way to access HBO content, forcing them to seek alternative means.",,,,
Censorship,MIB issues advisory for OTT platforms,Applicable Across India,2025,2/21/2025,
Censorship – The Arts,"The ministry of information and broadcasting issued an advisory directing streaming platforms to ensure that they do not transmit illegal content, and that their content is classified according to age.",,,,
Censorship,Remove videos of station stampede: Rlys notice to X,Applicable Across India,2025,2/21/2025,
Censorship – Social Media,"Railways ministry orders X to remove 285 links of casualty videos from the New Delhi stampede, citing ethical norms and potential law issues.",,,,
Attacks,Senior AIR journalist Karamat Qayoom manhandled by Baramulla Tehsildar,Jammu and Kashmir,2025,2/18/2025,
Attacks – Journalist,"In a shocking incident, Karamat Qayoom, senior journalist and Bureau Chief of All India Radio’s Shaherbeen program, was allegedly manhandled and pushed by Tehsildar Baramulla, Mohammed Hussain Mir, during the Deputy Chief Minister’s visit to the Dak Bungalow in Baramulla.",,,,
Censorship,Crackdown on ‘Ideological’ Books: J&K Police Seize 668 Copies,Jammu and Kashmir,2025,2/15/2025,
Censorship – Publications,"The move has sparked a debate on censorship, intellectual freedom, and security in the region, with political voices and academics raising concerns over the implications of such actions.",,,,
