Category,Title,State,Year,Date,Description
Censorship,"Globally Renowned Scholar of Hindi, Francesca Orsini, Deported from Delhi Airport Despite Valid Visa",Applicable Across India,2025,10/21/2025,
Censorship – Academia,"Francesca Orsini, scholar of Hindi and professor emerita at SOAS, London University, was tonight stopped from entering India even though she has a valid 5 year e-visa and told that she was being deported immediately.",,,,
Arrests,"Rajasthan police detain 2 journalists, Anand Pandey and Harish Divekar, from Madhya Pradesh for ‘illegal demand of Rs 5 crore’",Rajasthan,2025,10/17/2025,
Arrests – Journalists,"The Rajasthan Police on Friday picked up two journalists from Bhopal, Madhya Pradesh, claiming that they had carried false and defamatory stories against Rajasthan Deputy Chief Minister Diya Kumari and demanded Rs 5 crore to take them down.",,,,
"Censorship, Lawfare","Mumbai Police book, detain TISS students who attended G.N. Saibaba death anniversary gathering; laptops, phones seized",Maharashtra,2025,10/13/2025,
"Lawfare – Detention, Others | Censorship – Protests/Meetings","A team of Mumbai Police entered the Tata Institute of Social Sciences (TISS) campus late Monday night with heavy force and detained several students for organising a peaceful gathering in memory of late human rights defender G.N. Saibaba on his first death anniversary, observed the previous day.",,,,
Lawfare,Independent journalist Ajit Rathi served a legal notice by Uttarakhand government,Uttarakhand,2025,10/11/2025,
"Lawfare – General, Journalists",The Press Association and the Press Club of India on Saturday condemned the Uttarakhand government for issuing a legal notice to an independent journalist over his reportage on land deals in the hill state.,,,,
Killings,Bagalkot journalist Basavaraj Kanakond murdered for blackmailing illegal rice racket,Karnataka,2025,10/8/2025,
Killings – Journalists,"The death of journalist Basavaraj Kanakond in Karnataka’s Bagalkot, initially believed to be a road accident, has been confirmed as murder linked to blackmail over an illegal rice supply racket, police said on Saturday. Bagalkot police have apprehended three individuals in connection with the case.",,,,
Threats,"Singer Nilotpal Bora threatens to smash journalists’ cameras, later downplays responsibility",Assam,2025,9/29/2025,
Threats – Journalists,"Singer Nilotpal Bora was caught on camera threatening to break journalists’ equipment—saying he would “smash any camera I see inside”—and urging media to be driven out. When reporters confronted him afterward, he offered a dismissive remark that appeared to downplay his earlier threat. The incident has drawn criticism from the press and raised concerns about intimidation of journalists.",,,,
Killings,"‘Threatened after reports’, missing Uttarkashi journalist, Rajeev Pratap Singh, found dead",Uttarakhand,2025,9/28/2025,
Killings – Journalists,"Ten days after he went missing, the body of journalist Rajeev Pratap Singh was recovered from a barrage in Uttarakhand’s Uttarkashi district on Sunday.",,,,
Lawfare,"Wangchuk held under NSA, flown from Leh to Jodhpur as Govt cracks down",Ladakh,2025,9/26/2025,
"Lawfare – National Security, Others","Climate activist Sonam Wangchuk, who has been spearheading the movement seeking statehood and protections under the Sixth Schedule for Ladakh, was detained under the stringent National Security Act (NSA) by the police in Leh on Friday. His wife said he has been taken to a jail in Jodhpur.",,,,
Attacks,"Journalist from NMF News, Sumit Tiwari, attacked during protest coverage",Uttarakhand,2025,9/25/2025,
Attacks – Journalists,"A reporter from NMF News, Sumit Tiwari, was attacked while covering a protest by the ‘Berozgar Sangathan’ at the Parade Ground in Dehradun.",,,,
Threats,NMA advisor Rosemary Dzüvichü reports ‘death threat’ over women’s reservation advocacy,Nagaland,2025,9/23/2025,
Threats – Others,"Advisor to the Naga Mothers Association (NMA), Rosemary Dzüvichü, has reported receiving a death threat on the evening of September 23. The message was reportedly directed at her “and young and old feminists who have stood for women reservation.”",,,,
Censorship,"Protests over ‘I Love Muhammad’ signboards in Gujarat; 17 held, 88 booked",Gujarat,2025,9/22/2025,
"Censorship – Protests, Social Media","In the wake of ‘I Love Muhammad’ protests across the country, the Gujarat police arrested 17 persons and registered cases against more than 80 others for allegedly vandalising a police station in Godhra. The detained men, tied with ropes and visibly injured, were publicly shamed, struggling to walk.",,,,
Arrests,"YSRCP legal cell condemns alleged “illegal detention” of social media activists, Savindra Reddy, Tarak Pratap Reddy, and Surya (Sai) Bhargav",Andhra Pradesh,2025,9/22/2025,
Arrests – Others,"Yuvajana Sramika Rythu Congress Party (YSRCP) Legal Cell on Wednesday strongly condemned the continued alleged illegal detentions of social media activists by the Andhra Pradesh police, despite repeated warnings from the High Court, said a statement from M Manohar Reddy, President of YSRCP Legal Cell.",,,,
Lawfare,"Gujarat court issues notices to two journalists, Abhisar Sharma and Raju Parulekar, on Adani Group’s defamation complaint",Gujarat,2025,9/16/2025,
"Lawfare – Defamation, Journalists","A court in Gandhinagar has issued notices to journalists Abhisar Sharma and Raju Parulekar for personal appearance on September 20, after criminal defamation complaints were filed against them by Adani Group.",,,,
Censorship,13 news publishers ordered to remove posts on Adani group,Applicable Across India,2025,9/16/2025,
Censorship – News Media/ Documentaries,The Ministry of Information and Broadcasting ordered 13 news publishers to remove allegedly defamatory content about Adani following a Delhi court ruling.,,,,
Censorship,"I&B Ministry Orders Takedown of 138 Videos, 83 Instagram Posts About Adani Using Ex-Parte Court Order",Applicable Across India,2025,9/16/2025,
Censorship,The Union Ministry of Information and Broadcasting on Tuesday (September 16) sent notices to two media houses and a number of YouTube channels ordering them to take down a total of 138 videos and 83 Instagram posts that mentioned the Adani Group.,,,,
Lawfare,"Kerala Police File FIR Against Journalists, Activists Who Gathered to Protest Crackdown on Media",Kerala,2025,9/13/2025,
"Lawfare – Journalists, Others","On September 13, a group of journalists, activists and advocates gathered in Kochi, Kerala, to voice their concerns about the increasing crackdown on journalists and their arbitrary arrests. The meeting was organised as part of an ongoing campaign to demand the release of 26-year-old Kerala-based journalist Rejaz M. Sheeba Sydeek, who was arrested by the Maharashtra Anti-Terrorism Squad (ATS) on May 7.",,,,
Censorship,Modi-Shah-Yogi in ‘Pyramid of Capitalist India’: IIT-B distances from workshop poster after backlash,Maharashtra,2025,9/11/2025,
Censorship – Academia,"A flyer for a joint IIT Bombay, UC Berkeley, and UM-Amherst event featuring Indian leaders with the caption ‘We fool you’ went into circulation without the knowledge or consent of IIT-B, the institute has said in a statement, as it distances itself from the controversy.",,,,
Censorship,Congress accuses TRAI of censorship in blocking SMS link to Maharashtra election ‘fraud’ documentary,Applicable Across India,2025,9/7/2025,
Censorship – News Media/Documentaries,"The Indian National Congress on Sunday alleged that the Telecom Regulatory Authority of India (TRAI) rejected its application to send SMS messages containing a link to a YouTube documentary titled “How the MH 2024 Election Was Stolen,” citing the content as “related to protest.”",,,,
Censorship,"Delhi High Court Restrains All, Activists, Journalists From Publishing Defamatory Content Against Adani Enterprises",Applicable Across India,2025,9/6/2025,
Censorship – News Media/Documentaries,"Delhi court has issued an interim injunction restraining several journalists, activists, and foreign-linked NGOs from publishing or circulating what it called “unverified and defamatory” content against Adani Enterprises Limited (AEL). The order, passed on Saturday, also directed the defendants to remove alleged defamatory material from websites, social media posts, and videos within five days.",,,,
Censorship,India Bans Austrian Economist’s X Account After “Dismantle India” Post,Applicable Across India,2025,9/5/2025,
Censorship – Social Media,"In a swift move, the Government of India has blocked the X (formerly Twitter) account of Austrian economist Gunther Fehlinger-Jahn after he posted a controversial message calling to “dismantle India,” accompanied by a map of Khalistan.",,,,
Attacks,Reporter Deep Saikia Shot at a Week After He Was Threatened by Nagaland Deputy CM,Nagaland,2025,8/30/2025,
Attacks – Journalists,"Barely a week after Nagaland deputy chief minister and senior Bharatiya Janata Party (BJP) leader Y. Patton had threatened a reporter of a local TV channel at a public meeting, the reporter was shot at in a Naga village in the Senapati district of Manipur.",,,,
Censorship,Islamic groups opposed to inviting Javed Akhtar force Bengal’s Urdu Academy to call off literary event,West Bengal,2025,8/30/2025,
Censorship – The Arts,"The State-run West Bengal Urdu Academy, which was all set to hold a four-day festival to celebrate Urdu in Hindi cinema, has put off the event following opposition from some Islamic organisations to inviting lyricist Javed Akhtar for it.",,,,
Attacks,Hindu Sena members disrupted the People’s Tribunal on Assam press conference,Delhi,2025,8/26/2025,
Attacks – Journalists,"During the People’s Tribunal on Assam press conference at the Constitution Club of India, Hindu Sena members stormed the venue, shouting “Jai Shri Ram” slogans and disrupting the event for nearly 10 minutes. The speakers—Harsh Mander, Justice Iqbal Ansari, and Wajahat Habibullah—faced verbal threats. The conference focused on the unregulated and targeted evictions of Muslims in Assam. FOEJ reporters, present on-site, spoke with Hindu Sena president Vishnu Gupta, who called the event a “conspiracy to take down the Assam government.” This disruption follows recent remarks by Assam CM Himanta Biswa Sarma, who threatened action against journalists and activists covering the demolitions. Sarma also controversially stated he would “send” Jamiat President Mahmood Madani to Bangladesh, raising serious concerns of communal targeting.",,,,
Censorship,"Maharashtra: Facing online backlash, including from Brahmin group, content creator deletes video promoting religious harmony, apologises",Maharashtra,2025,8/26/2025,
Censorship – Social Media,"Marathi content creator Atharva Sudame deleted a reel promoting religious harmony and pluralism following backlash on social media. Anand Dave of the Brahmin group Akhil Bharatiya Brahman Mahasangh also opposed the video. Sudame later put out an apology video saying he did not intend to hurt sentiments and that he had previously created multiple reels on Hindu festivals, Marathi culture and Marathi language. Dr Hamid Dabholkar of the Maharashtra Andhshraddha Nirmoolan Samiti (MANS) opposed the hate directed towards Sudame by saying that taking down the reel was a sign of an intolerant society.",,,,
Policies/Regulation,Who Has the Right to Free Speech Online? The Supreme Court has asked the Centre to frame guidelines to regulate online speech.,Applicable Across India,2025,8/25/2025,
Policies/Regulation,"On August 25, 2025, while listening to the case against Samay Raina and others, the Supreme Court asked the Central government to frame guidelines to regulate speech on social media. Since influencers on social media often monetise their content, they commercialise free speech in ways that might be offensive to vulnerable and marginalised communities, the court said.",,,,
Censorship,Delhi High Court orders Sci-Hub to be blocked in India,Applicable Across India,2025,8/23/2025,
Censorship – Academia,"The Delhi High Court has reportedly ordered Sci-Hub, Libgen and other shadow libraries to be banned in India. The Court has ordered the Ministry of Electronics and Information Technology (MeitY) and the Department of Telecommunications (DoT) to take necessary steps to immediately block these websites within the next 24 hours.",,,,
Censorship,"Senior journalist Ruben Banerjee’s YouTube channel, Mu Ruben Kahuchhi (I am Ruben speaking), suddenly removed on 6 August 2025",Applicable Across India,2025,8/6/2025,
Censorship – News Media/Documentaries,"The Editors Guild of India (EGI) strongly condemned the sudden removal of senior journalist Ruben Banerjee’s YouTube channel, Mu Ruben Kahuchhi (I am Ruben speaking), stating that it raises “serious questions of freedom of expression, platform power, and the lack of clarity in digital governance”.",,,,
Lawfare,Assam Police File Sedition Case Against Journalist Abhisar Sharma Over Video Criticising CM,Assam,2025,8/21/2025,
Lawfare – National Security (Journalists),"Continuing its vindictive action against journalists, the Assam police on Thursday registered an FIR against Delhi-based journalist Abhisar Sharma under multiple sections of the Bharatiya Nyay Sanhita (BNS), including section 152.",,,,
Threats,Editors Guild Calls Out Congress For Case Threat To NDTV’s Shiv Aroor,Delhi,2025,8/19/2025,
Threats – Journalists,"The Editors Guild of India has expressed concern after senior Congress leader Pawan Khera threatened NDTV Managing Editor Shiv Aroor with a criminal complaint for the August 19 episode of Mr Aroor’s popular show, India Matters.",,,,
Censorship,Madras High Court to privately screen Manushi after 37 censor cuts spark row,Applicable Across India,2025,8/19/2025,
Censorship – The Arts,"In a rare move, the Madras High Court has decided to directly view the Tamil film Manushi before ruling on a dispute between its makers and the Central Board of Film Certification (CBFC).",,,,
Internet Control,"BSNL’s Selective Website Blocking Violates Net Neutrality, Hides Reasons Behind RTI Loophole",Applicable Across India,2025,8/13/2025,
Internet Control,"MediaNama’s Take: The selective blocking of legitimate websites by BSNL in certain regions is completely against the principles of net neutrality and the fundamental right to open and free access to the internet. The state-owned telecom company has also failed to provide a lawful basis for its blocking actions. Citing Section 8(1)(d) of the RTI Act to withhold blocking orders for sites such as Telegram’s short link, Bitly, The Movie Database, and Dailymotion blatantly misuses a provision meant to protect trade secrets and intellectual property.",,,,
Censorship,Maharashtra Asks Union Govt to Stop the Release of ‘Khalid Ka Shivaji’,Applicable Across India,2025,8/7/2025,
Censorship – The Arts,"“The government has taken a serious note of the complaints received about the movie. There is a demand to ban the movie,” a Maharashtra minister said.",,,,
Censorship,St Xavier’s College (Mumbai) cancels annual Stan Swamy Memorial Lecture after ABVP protest,Maharashtra,2025,8/6/2025,
Censorship – Academia,"The lecture, organised by the college’s department of inter-religious studies, was to have been delivered by Fr Prem Xalxo on “Migration for Livelihood: Hope amidst miseries.”",,,,
Lawfare,Shwetha Menon booked under obscenity charges ahead of AMMA elections,Kerala,2025,8/6/2025,
Lawfare – Others,"Actor Shwetha Menon has been booked by the Ernakulam Central Police on non-bailable charges under multiple sections of law, including Section 67A of the Information Technology Act, for allegedly earning money through films and advertisements containing sexually explicit content. The case was registered following directions from the Ernakulam Chief Judicial Magistrate Court, based on a complaint by social activist Martin Menachery.",,,,
Censorship,"Assam Tribune rejects column critical of BJP & Himanta, asks veteran journalist Patricia Mukhim to ‘focus only on Meghalaya’",Assam,2025,8/6/2025,
Censorship – News Media/Documentaries,"Within hours of sending in her bimonthly column to The Assam Tribune on the violation of human rights and ‘dehumanization’ of Bengali-speaking Muslims in Assam, veteran journalist Patricia Mukhim was told by the paper on August 6 that the management had decided not to carry the piece. She was also instructed to concentrate only on Meghalaya.",,,,
Attacks,"YouTubers assaulted in Dharmasthala, police lathicharge to control tension",Karnataka,2025,8/6/2025,
Attacks – Journalists,"Ajay Anchan who runs the Kudla Rampage YouTube channel, Abhishek of United Media and Santhosh of Sanchari Studio were assaulted on the Dharmasthala-Pangala Road in Dharmasthala around 5 pm.",,,,
Lawfare,Press Club of India seeks withdrawal of FIR against journalist Sanjeev Sharma in Himachal Pradesh,Himachal Pradesh,2025,8/3/2025,
Lawfare – Journalists,"An FIR was filed against Sanjeev Sharma, editor of Samwad Bharat, by Shimla Police. Sharma had reposted a Facebook message from the son of a road accident victim, which criticized the police response.",,,,
Attacks,Journalist Balvinder Kumar Bhalla was brutally assaulted after he questioned two police officials,Punjab,2025,8/1/2025,"Attack – Journalists
Journalist Balvinder Kumar Bhalla was brutally assaulted on the road in Batala on August 1, 2025, between 6:00/6:30 PM, after he questioned two police officials. The attackers – Sub Inspectors Mandeep Singh and Surjit Kumar of Bathinda Police now face an FIR under BNS Sections 115(2), 118(1), and 3(5), registered at Batala Civil Lines Police Station. Both police officers are residents of Bathinda.
Read More"
Censorship,"Screened at KIFF 2024, Bengali film ‘Kalponik’ now faces censorship hurdles",Applicable Across India,2025,7/29/2025,
Censorship – The Arts,"A Bengali film, which was screened at the Kolkata International Film Festival (KIFF) last year, has met with Censor Board hurdles for its storyline and some scenes referring to the discovery of an ancient temple underneath the floor of a place of worship, making its director frustrated.",,,,
Lawfare,"Gujarat Congress leader files complaint against news channel editor, anchor for defamation",Gujarat,2025,7/25/2025,
"Lawfare – Defamation, Journalists","Former Union Minister and newly appointed Congress Legislature Party (CLP) leader in the Gujarat Assembly, Dr Tushar Chaudhary, has lodged a complaint of defamation and under Atrocity Act against the editor of a news channel and an anchor of another on Friday evening.",,,,
Censorship,"25 OTT platforms, including Ullu and ALTT, blocked for streaming obscene, pornographic content",Applicable Across India,2025,7/25/2025,
Censorship – The Arts,"The Ministry of Information and Broadcasting (I&B) has directed that public access to 25 OTT platforms, including Ullu, ALTT, and Desiflix, be disabled for streaming obscene, and at times, pornographic content, sources in the government said. The direction to block the websites and apps of these 25 OTT platforms came on July 23, they added.",,,,
Attacks,Kashmir Journalist Roughly Handled By Protesting Doctors Seeks Press Bodies’ Intervention,Jammu and Kashmir,2025,7/25/2025,
Attacks – Journalists,A female journalist from Kashmir on Thursday (July 24) approached the Press Council of India (PCI) among other media advocacy groups after she and at least four other journalists were allegedly roughly handled a day earlier by doctors who were protesting outside a hospital in Srinagar.,,,,
Censorship,"Dharmasthala temple Dharmadhikari’s brother gets gag order to delete over 8,800 links",Applicable Across India,2025,7/18/2025,
Censorship – News Media /Documentaries,"In a sweeping move, a Bengaluru court has ordered the takedown of thousands of links across media and social platforms, invoking a John Doe order in the Dharmasthala burial case.",,,,
Censorship,Maharashtra passes bill to curb ‘Urban Naxalism’; CM says it targets passive militancy,Maharashtra,2025,7/10/2025,
Censorship,"“Maharashtra becomes the fifth state after Telangana, Andhra Pradesh, Odisha and Jharkhand to enact a special public security law to curb ‘urban Naxalism.’ The bill is yet to be tabled in the legislative council. The Maharashtra legislative assembly on Thursday passed a bill aimed at curbing ‘Urban Naxalism’ in the state, which seeks to prevent unlawful activities of Left Wing Extremist organisations.",,,,
Attacks,"‘Bring petrol, Let’s Burn Him’: ‘NewsToday’ Contributor Assaulted by Sand Mafia in Andhra Pradesh",Telangana,2024,2/15/2025,"Recalling the horrific assault, Rao said that he was on a story about illegal sand mafia in the Malladi sand reach. Rao said that on his way back home, goons affiliated with the ruling YSRCP attacked him and punched him in the chest and face leading to physical injuries to him. He said the accused also tried to set him on fire with petrol.
Amaravati: In a shocking case of attack on a journalist, members of the sand mafia believed to be affiliated with the ruling YSRCP on Wednesday allegedly assaulted and attempted to kill Telaprolu Parameshwara Rao, a contributor working with ‘NewsToday’ by trying to set him on fire while he was on professional duty in Amaravati Mandal of Palnadu district of Andhra Pradesh.
Rao said that on Wednesday morning, he was on a story on illegal sand mining in Malladi sand reach where he took pictures for the story. While on his way back, goons affiliated with the ruling YSRCP led by Vempa Srinu and his followers including Tulsi Tirupathi Rao, Bhavirishetti Sunil, Bhavirishetti and Nageswara Rao chased him and attacked him without any provocation, Rao said.
He said that the goons pushed him down and punched him in the chest and face leading causing him physical injuries. Rao said that the assault was so severe that he stopped breathing for some time. Rao, who somehow escaped from the captivity, was talking to the police on the phone. While he was on the call, the goons came running, grabbed the cell phone, and attacked him again, he said.
Read More"
Censorship,"In dangerous precedent, Harvard journal forced to drop article on Khalistani terrorism",Punjab,2025,3/3/2025,
Censorship – Academia,"The Harvard International Review unpublished an article on Khalistani terrorism and its impact on India-Canada ties by an Indian student after complaints from Sikh organisations. Harvard is facing backlash for pulling out the article, and a petition has been started to hold the Ivy League university accountable.",Delhi,2025,1/27/2025,"Digital news units of Indian billionaires Gautam Adani and Mukesh Ambani, and other outlets including the Indian Express and the Hindustan Times, are joining proceedings against OpenAI for improperly using copyright content, legal papers show.
Courts globally are hearing claims by authors, news organisations and musicians who accuse technology firms of using their
India has more than 690 million smartphone users thanks to cheap mobile data plans and OpenAI has said the country is a critical market.
The Indian media outlets, including Adani’s NDTV (NDTV.NS) and Ambani’s Network18 (NEFI.NS), opens new tab, have told a New Delhi court they want to join an ongoing lawsuit against the ChatGPT creator as they are worried their news websites are being scraped to store and reproduce their work for users of the powerful AI tool.
Read More"
Censorship,TISS issues an advisory warning against the public screening of the BBC documentary on Modi on Mumbai campus,Maharashtra,2023,1/27/2023,
Censorship – Academia | Censorship – Entertainment,"On January 27, 2023, TISS issued an advisory warning against the public screening of the controversial BBC documentary on PM Narendra Modi film on the campus. The institute had issued advisories to students and the management of its branches, besides the main one campus in Mumbai, against any such mass event. Not heeding to the “advisory” would be “dealt with strictly as per the rules”, warned the advisory accessed by NDTV. It said the screening was an attempt to “trigger” students. The TISS administration had also issued a fresh warning on Saturday, January 28, 2023.",,,,
Arrests,Jharkhand Police Arrest Independent Journalist Rupesh Kumar Singh,Jharkhand,2022,7/17/2022,
"Arrests – Journalists | Lawfare, National Security – Journalists","Rupesh Kumar Singh, an independent Journalist, covering news of Adivasi Rights violations, was arrested by Jharkhand Police on Sunday afternoon, July 17, 2022. Singh was slapped with Sections 10 and 13 of the draconian Unlawful Activities (Prevention) Act (UAPA) as well as IPC sections 420 (Cheating), 467, 468 and 471 (related to committing forgery). Singh continues to languish in prison.",,,,
Killings,"Ashutosh Srivastava, a correspondent of Sudarshan News, shot dead in Jaunpur, Uttar Pradesh",Uttar Pradesh,2024,5/13/2024,
Killings – Journalists,"Ashutosh Srivastava, a 43-year-old journalist and BJP leader was shot dead in the Shahganj area of in Jaunpur district in Uttar Pradesh. Family sources said Srivastava had written to officers at the Shahganj police station a month ago and requested protection, but the cops did not pay heed to his request.",,,,
Killings,"Salman Ali Khan, a journalist, shot dead by unknown assailants in Rajgarh, Madhya Pradesh",Madhya Pradesh,2024,9/18/2024,
