Category,Title,State,Year,Date,Description
Arrests – Journalists,"The Andhra Pradesh police arrested Kommineni Srinivasa Rao, a senior journalist working in Sakshi Telugu Television on Monday, who landed in a huge controversy after he moderated a debate with V.V.R. Krishnam Raju, a journalist and political analyst recently. The people from various sections and regions have lodged multiple complaints with the police over a debate that allegedly contained derogatory comments on the women from Amaravati region and which was aired in Sakshi TV, which was moderated by Srinivasa Rao.",,,,
Internet Control,Men Douse Themselves In Petrol As Protests Erupt Over Arrest; Internet Shut Down Across Manipur,Manipur,2025,6/8/2025,
Internet Control,A video circulating on the internet shows a group of men dressed in black pouring petrol over themselves and threatening to set themselves on fire in a symbolic protest against the arrest of a key Arambai Tenggol leader on Saturday.,,,,
Censorship,J&K bans 25 books citing ‘false narrative’ and ‘glorification of terrorism’,Jammu and Kashmir,2025,8/6/2025,
Censorship,"In an unprecedented move, the Jammu and Kashmir administration has ordered the forfeiture and ban of 25 books, alleging that they propagate secessionism, glorify terrorism, and pose a threat to national integrity and public order.",,,,
Censorship,"MF Husain’s Painting Auction Gets Bombay HC Nod; Hindu Janajagruti Samiti Demands Ban, Citing ‘Anti-National’ Art",Maharashtra,2025,6/6/2025,
Censorship – The Arts,"Hindu Janajagruti Samiti has demanded a ban on the auction of MF Husain’s paintings that is scheduled on June 12 at the Pundole Art Gallery in Mumbai. Recalling the painter’s controversial past, it has warned of strong public agitation if the auction is carried out.",,,,
Censorship,Diljit Dosanjh’s ‘Punjab 95’ stuck in censor board limbo with 127 demanded cuts,Applicable Across India,2025,6/4/2025,
Censorship – The Arts,"More than two years after completion, Punjab 95, starring Diljit Dosanjh as human rights activist Jaswant Singh Khalra, remains unreleased, trapped in a cycle of delays and censorship. Despite being privately screened at Cannes for a small group of Indian and international journalists, the film’s official release date is still nowhere in sight.",,,,
Lawfare,ANI files defamation case against YouTuber Mohak Mangal and others over extortion claims video,Delhi,2025,5/28/2025,
"Lawfare – Defamation, Others | Lawfare – Defamation, Journalists","Asian News International has filed a defamation suit in the Delhi High Court against YouTuber Mohak Mangal for posting an allegedly defamatory video accusing the news agency of extortion and blackmail, Bar and Bench reported on Wednesday.",,,,
Threats,Madhya Pradesh-based journalist Amarkant Singh Chouhan says there was threat to his life,Madhya Pradesh,2025,5/28/2025,
Threats – Journalists,The Delhi High Court on Wednesday granted protection to a Madhya Pradesh-based journalist who claimed there was threat to his life by the Bhind superintendent of police after he was allegedly beaten in his office.,,,,
Lawfare,"FIR filed against fruit vendor, Suleman, for allegedly sharing an AI-generated image of Prime Minister Modi with the words “Pakistan Zindabad",Himachal Pradesh,2025,5/27/2025,
"Lawfare – General, Others","An FIR registered was registered under Section 152 of the BNS against Suleman, a fruit vendor. According to the prosecution, the petitioner allegedly shared an AI-generated image of the Prime Minister with the words “Pakistan Zindabad.” The act was treated as inflammatory and prejudicial to national interest. As a consequence, the petitioner surrendered and was arrested the same day.",,,,
Attacks,Journalists assaulted by private bouncers in Raipur,Chhattisgarh,2025,5/25/2025,
Attacks – Journalists,"Some journalists who were reporting on a story were assaulted by bouncers from a private security agency stationed at a government hospital. In response, the journalists strongly resisted the incident and staged a dharna in front of the Chief Minister’s residence, demanding action. The protest prompted the administration to take swift measures, assuring that action would be taken against the perpetrators.",,,,
Censorship,Dhadak 2 Receives UA16+ Certification From CBFC After Major Cuts,Applicable Across India,2025,5/24/2025,
Censorship – The Arts,"The upcoming film Dhadak 2 by filmmaker Karan Johar has finally cleared the CBFC wall, but not without taking a few hits. The Central Board of Film Certification (CBFC) approved the film with a U/A 16+ certificate, but demanded several changes in dialogues, visuals, and disclaimers.",,,,
"Censorship, Lawfare","Case against Indore cartoonist, Hemant Malviya, over obscene posts aimed at maligning RSS’s image",Madhya Pradesh,2025,5/23/2025,
"Censorship – News Media/Documentaries, Lawfare – General, Others","The Madhya Pradesh Police has filed a case against Indore-based cartoonist Hemant Malviya for posting objectionable material online on Prime Minister Narendra Modi, the Rashtriya Swayamsevak Sangh (RSS) and Lord Shiva.",,,,
"Censorship, Lawfare",Case against Indore cartoonist over obscene posts aimed at maligning RSS’s image,Madhya Pradesh,2025,5/23/2025,
"Lawfare – General, Others | Censorship – The Arts","The Madhya Pradesh Police has filed a case against Indore-based cartoonist Hemant Malviya for posting objectionable material online on Prime Minister Narendra Modi, the Rashtriya Swayamsevak Sangh (RSS) and Lord Shiva.",,,,
Attacks,"Indian journalist, Bijay Pradhan assaulted reporting on construction irregularities in Odisha",Odisha,2025,5/23/2025,"“Journalist Bijay Pradhan’s brutal attack is yet another grave reminder of the growing dangers faced by local journalists across India, particularly those targeted in the eastern state of Odisha,” said CPJ India Representative Kunāl Majumder. “Authorities must ensure a swift and impartial investigation and bring those responsible to justice.”
Pradhan, a reporter with the privately-held Odia-language news outlet Bada Khabar, was tied up and brutally beaten by a group of men on May 23 while reporting on alleged irregularities in a local construction project in the Kulthipali village of Bolangir district. A video of the assault widely shared on social media, shows Pradhan being kicked and dragged by a group. The assault went on for two hours and resulted in the rupture of his right eardrum. He is undergoing treatment for his injuries in Bhima Bhoi Medical College and Hospital, Pradhan told CPJ.
Pradham said his attackers also snatched his mobile phone, on which he had recorded the incident, his microphone, and other equipment to stop him from reporting.
Read More"
Killings,Haryana journalist Dharmendra Singh Chauhan killed in targeted shooting,Haryana,2025,5/18/2025,
Killings – Journalists,"Journalist Dharmendra Singh Chauhan was shot and killed by unidentified assailants on May 18 while walking near his home in India’s northern Haryana state. The International Federation of Journalists (IFJ) and its affiliates, Indian Journalists Union (IJU) and the National Union of Journalists India (NUJ-I), call on the authorities to commence an immediate and transparent investigation into his murder and ensure journalists can work without fear of violence and intimidation.",,,,
Harassment,"Indian-origin professor, Nitasha Kaul, who lost OCI tag testified against India on Kashmir in US",Applicable Across India,2025,5/18/2025,
Harassment – Others,"Nitasha Kaul, a UK-based Indian-origin professor, lost her Overseas Citizen of India (OCI) status over anti-India activities. The Kashmiri Pandit academician testified before a US Congressional Committee after the revocation of Article 370, criticising human rights violations in Kashmir.",,,,
Lawfare,"Pushpa Sathidar, wife of late activist Vira Sathidar, booked over alleged inflammatory remarks",Maharashtra,2025,5/17/2025,
"Lawfare – National Security, Others","The Sitabuldi police in Nagpur on Saturday registered a case against Pushpa Sathidar, 51, social activist and widow of the late actor and human rights campaigner Vira Sathidar, for allegedly making provocative statements during a memorial programme held in central Nagpur.",,,,
Arrests,"52 held in Assam for “supporting Pakistan”; critics say crackdown targets Muslim youths, content is anti-war, anti-govt",Assam,2025,5/14/2025,
Arrests – Others,"Chief Minister Himanta Biswa Sarma on Tuesday announced that two additional individuals had been arrested from Sonitpur district, bringing the total number of arrests to 58. Taking to social media platform X, the Chief Minister wrote, “58 Pak sympathisers are behind bars. They will also receive special care for their anti-national activities.” He further asserted that the crackdown on what he termed “traitors” would persist, stating that “nobody will be spared.”",,,,
"Arrests, Censorship","UP Cyber Crime HQ Targets Anti-National Content, Blocks 40 Accounts And Arrests 25 For Spreading Misinformation",Uttar Pradesh,2025,5/14/2025,
"Arrests – Others, Censorship – Social Media","Following the recent India-Pakistan tensions, Uttar Pradesh Police arrested 25 individuals for posting anti-national content on social media platforms such as Facebook, Instagram, and YouTube. Cyber Crime Headquarters blocked 40 accounts spreading misinformation related to the Indian Army’s counter-terrorism operations. The arrests followed an order from Chief Minister Yogi Adityanath, and investigations are ongoing.",,,,
Harassment,‘Why Only Us?’: Kashmiri Students at Delhi University Decry Privacy Breach,Delhi,2025,5/13/2025,
Harassment – Others,Fears of profiling after DU seeks Aadhaar and address details in unofficial group; students say move feels unsafe and discriminatory.,,,,
Harassment,Alt News co-founder Mohammed Zubair’s home address and phone number were leaked online,Applicable Across India,2025,5/12/2025,
Harassment – Journalists,"Alt News co-founder Mohammed Zubair tweeted that his home address and phone number were leaked online by some people, and they also threatened to send pork to his address. He said, “There are already life threats against me. This isn’t the first time. The same person in 2023 had sent Pork to my address and shared the shipping address on Twitter.” He added that he had filed a complaint with the Deputy Commissioner of Police, East Bengaluru and hoped that they would take the threat seriously.",,,,
Attacks,Pro-Palestine activists manhandled by Hindutva mob in Pune; group alleges police refused to file FIR,Maharashtra,2025,5/12/2025,
Attacks – Others,Activists and volunteers from Indian People in Solidarity with Palestine and BDS India were reportedly assaulted and manhandled by Hindu right-wing groups in Pune’s Karve Nagar while they were peacefully demonstrating and distributing pamphlets urging people to stand in solidarity with Palestine and oppose the ongoing genocide in Gaza.,,,,
Lawfare,Summons issued by Haryana State Women’s Commission to Ashoka University professor Ali Khan Mahmudabad,Haryana,2025,5/12/2025,
Lawfare – Summons/Notices,"The Haryana State Women’s Commission issued a summons to Ashoka University professor Ali Khan Mahmudabad for two of his social media posts, alleging that he made statements that allegedly “disparaged women officers in the Indian Armed Forces and promoted communal disharmony”. Prof Mahmudabad has contested the allegations and said they constitute “a new form of censorship and harassment, which invents issues where there are none.”",,,,
Censorship,X handle of Kashmir Life withheld in India,Applicable Across India,2025,5/11/2025,
Censorship – News Media / Documentaries,"Journalist Tahir Bhat reported that the X handle of Kashmir Life, a leading weekly news magazine published from Srinagar, Kashmir, was withheld in India.",,,,
Censorship,Outlook India’s X account blocked in India,Applicable Across India,2025,5/11/2025,
Censorship – News Media / Documentaries,"On 11th May 2025, Outlook India had reported that their official X account (@Outlookindia) was blocked without prior notice. They said they had reached out to both X (formerly Twitter) and the Ministry of Information and Broadcasting, requesting an immediate restoration of access. Outlook They added that they had upheld the highest quality of objective and balanced journalism for thirty years, and would continue to do so.",,,,
Censorship,"Tamil Nadu assistant professor, S Lora, suspended for criticising Operation Sindoor",Tamil Nadu,2025,5/10/2025,
Censorship – Academia,"A private university in Tamil Nadu’s Chennai on Thursday suspended an assistant professor for criticising Operation Sindoor, saying that she was involved in “unethical activities”. S Lora, an assistant professor associated with the Directorate of Career Centre at SRM Institute of Science and Technology, posted status messages on her WhatsApp on civilian casualties.",,,,
"Arrests, Censorship","Farooq Ahmad, a man accused of sharing derogatory videos about PM Modi and Army, arrested",Himachal Pradesh,2025,5/9/2025,
"Arrests – Others, Censorship – Social Media","Farooq Ahmad was arrested on May 9 on charges of sedition, promoting enmity between groups and making assertions against national integrity, Live Law reported.",,,,
Censorship,The Wire’s website blocked in India,Applicable Across India,2025,5/9/2025,
Censorship – News Media/Documentaries,"On 10th May 2025, The Wire reported that the day before, more than 12-15 hours after The Wire‘s website was blocked in India on government orders – and some eight hours after they had formally written to the Ministry of Information and Broadcasting (MIB) and Ministry of Electronics and Information Technology (MEITY) seeking an explanation for their website being blocked, they had received a written ‘explanation’ from the MIB.",,,,
"Harassment, Threats",Journalist Arfa Khanum harassed and threatened,Applicable Across India,2025,5/9/2025,
Harassment – Journalists | Threats – Journalists,"In a tweet on X, journalist Arfa Khanum shared that she was being harassed and threatened. She said “I’ve been doxxed. My private phone number and email were leaked on Twitter. For the past 24 hours, I’ve been receiving nonstop threatening messages and calls. This is harassment. This is dangerous. And this should not be tolerated.”",,,,
Censorship,Kashmiriyat’s X handle withheld in India,Applicable Across India,2025,5/8/2025,
Censorship – News Media/Documentaries,"The Kashmiriyat, an independent media organisation based in Kashmir, reported that their X handle has been withheld in India.",,,,
Censorship,Force Magazine’s YouTube Video unavailable in India,Applicable Across India,2025,5/8/2025,
Censorship – News Media/Documentaries,"Force Magazine’s YouTube video dated 7 May, 2025 on Operation Sindoor where Pravin Sawhney explains “why violence in J&K will increase & not diminish” is no longer available in India.",,,,
Censorship,"X id of Haroon Khan, a political commentator, withheld in India",Applicable Across India,2025,5/8/2025,
Censorship – Social Media,Political commentator Harun Khan’s X id (@iamharunkhan) withheld in India.,,,,
Censorship,Political content creator Arpit Sharma’s X account withheld,Applicable Across India,2025,5/8/2025,
Censorship – Social Media,Political content creator Arpit Sharma said that his X Account has been withheld in India for speaking truth.,,,,
Censorship,Maktoob’s X account withheld in India,Applicable Across India,2025,5/8/2025,
Censorship – News Media/Documentaries,"Maktoob reported that in response to a legal demand, their X account has been withheld in India. They said that they have no knowledge of the reason for the government’s arbitrary action. “It is an assault on press freedom.” Maktoob pledged to continue its crucial work at a time when truth is becoming a casualty. It has been asking its allies to share links from their website to help people access their reporting.",,,,
Censorship,"Indian government required X to block over 8,000 accounts in India",Applicable Across India,2025,5/8/2025,
Censorship – Social Media,"On 8 May 2025, X reported that it had received executive orders from the Indian government requiring X to block over 8,000 accounts in India, subject to potential penalties including significant fines and imprisonment of the company’s local employees. The orders included demands to block access in India to accounts belonging to international news organizations and prominent X users. In most cases, the Indian government had not specified which posts from an account have violated India’s local laws. X added that for a significant number of accounts, they had not received any evidence or justification to block the accounts.",,,,
Censorship,"Govt asks OTT, streaming platforms to immediately pull Pakistan-origin content",Applicable Across India,2025,5/8/2025,
Censorship – The Arts,"The Union government has “advised” all OTT (over-the-top) and streaming platforms to immediately remove content originating from Pakistan — including shows, films, songs and podcasts — “in the interest of national security”.",,,,
"Arrests, Lawfare","Kerala-based left activist, Rejaz M. Sheeba Sydeek, arrested in Nagpur, social media posts criticising army mentioned in FIR",Maharashtra,2025,5/8/2025,
"Arrests – Others, Lawfare – National Security, Others","A left-wing activist and independent journalist from Kerala was arrested in Nagpur on Thursday, 8th May 2025, for his social media posts critical of the government.",,,,
Censorship,"Muslim, an independent media platform delivering Muslim news, stories, and coverage banned in India",Applicable Across India,2025,5/7/2025,
Censorship – News Media/Documentaries,"In a statement shared on Instagram, founder and editor-in-chief Ameer said that Meta has banned their page in India by legal request of the Indian government. “This is censorship.” He added that in a time when Western and legacy media publications continue to fail the Muslim community with harmful coverage and narratives, restricting access to information is detrimental.",,,,
Arrests,"Khadija Sheikh, an engineering student, arrested over pro-Pakistan social media post",Maharashtra,2025,5/7/2025,
"Censorship – Social Media, Arrests – Others","A 19-year-old IT engineering student, Khadija Sheikh, was arrested in Pune for sharing an Instagram story featuring pro-Pakistan and anti-Hindutva content amid rising India-Pakistan tensions. Booked under multiple sections of the Bharatiya Nyay Sanhita, police cited potential disruption to public order. Her account was deleted as investigations continued.",,,,
Censorship,YouTube Channel of Journalist Punya Prasun Bajpai blocked,Applicable Across India,2025,5/6/2025,
Censorship – News Media/Documentaries,"The YouTube Channel of Former News Anchor & Journalist Punya Prasun Bajpai with more than 50 Lakh Subscribers is not accessible on the YouTube anymore. Now, people on the social media are claiming that this is an action taken by the Union Government and Prime Minister Narendra Modi. People are also comparing it with the recent ban on 4PM YouTube Channel led by Sanjay Sharma.",,,,
Attacks,"District Public Relations Officer (DPRO), Gupteshwar Kumar assaulted Pramod Kumar, reporter of Dainik Bhaskar",Bihar,2025,5/6/2025,
Attacks – Journalists,"The Khelo India Youth Games 2025 are being organized at the Rajgir Sports Complex from May 4th to May 15th. However, while district administration officials themselves were seated, enjoying the games, spectators were stopped at the main gate. This news was published in the Dainik Bhaskar newspaper.",,,,
Lawfare,Senior journalist Hilal Mir detained by police intelligence wing in Srinagar,Jammu and Kashmir,2025,5/6/2025,
Lawfare – Detentions,"The Counter-Intelligence wing of the Jammu and Kashmir police Tuesday detained Hilal Mir, a journalist based in Kashmir, for allegedly “spreading anti-national content”.",,,,
Censorship,"Don’t invite Pakistani guests to TV shows, news associations tell channels",Applicable Across India,2025,5/5/2025,
Censorship – Self-censorship,The News Broadcasters and Digital Association and the News Broadcasters Federation urged members not to invite panellists who spread ‘anti-India propaganda’.,,,,
Internet Control,Doda administration bans use of VPNs in dist,Jammu and Kashmir,2025,5/3/2025,
Internet Control,"The Doda administration has banned the use of Virtual Private Networks (VPNs) in the district keeping in view the “public order, tranquillity and national security”.",,,,
Attacks,MP Journalists claim they were assaulted in Bhind SP’s office,Madhya Pradesh,2025,5/1/2025,
Attacks – Journalists,"Three journalists in Madhya Pradesh’s Bhind district alleged on Saturday that they were beaten up or manhandled inside the office of Superintendent of Police, an allegation he denied. SP Asit Yadav suggested that someone was instigating the journalists.",,,,
Censorship,"Amid the Pahalgam terror attack, the Indian government bans 16 Pakistani news, drama channels on YouTube.",Applicable Across India,2025,4/30/2025,
Censorship – The Arts,"In April 2025, the Indian government banned 16 Pakistani YouTube channels, including some of the most popular drama and news channels, amid the Pahalgam terror attack. Pakistani drama channels have an enormous fan base across India and Pakistan. Classic shows like Zindagi Gulzar Hai, Humsafar, and Tere Bin hugely contributed to the craze of Pakistani dramas. However, the recent ban of 16 Pakistani drama channels on YouTube is considered a major turning point in the cross-border digital entertainment dynamic. Let’s take a look at the list of 16 banned Pakistani channels on YouTube.",,,,
Censorship,Mallika Sarabhai alleges restrictions on free expression as chancellor of Kerala Kalamandalam,Kerala,2025,4/30/2025,
Censorship – The Arts,"Renowned dancer, activist, and Chancellor of Kerala Kalamandalam, Mallika Sarabhai, has alleged that limitations have been placed on her freedom of expression in her new academic role.",,,,
Censorship,"YouTube channel 4PM News banned over ‘national security’, editor-in-chief says was only asking questions",Applicable Across India,2025,4/29/2025,
Censorship – News Media/Documentaries,YouTube news channel 4PM has been banned in India because of a government order linked to “national security or public order”.,,,,
"Censorship, Harassment",Knocking News channel editor Girijesh Vashistha alleges hacking and censorship attempts,Applicable Across India,2025,4/12/2025,
Censorship – News Media/Documentaries | Harassment – Journalists,"On April 12, 2025, Girijesh Vashistha. senior journalist and editor of the news analysis Youtube channel Knocking News found that his channel was hacked and the logo changed, with posts of false news of cryptocurrency. In a video, he described how he complained to Youtube about how he had lost control of his channel, despite having two-factor authentication, and his attempts to restore it. Instead, he said the channel itself was blocked.",,,,
Attacks,"Dalit Journalist, Sanjay Ambedkar, Beaten at PVR for Reviewing ‘Phule’ Film — Entire Attack Caught on Camera!",Uttar Pradesh,2025,4/29/2025,
Attacks – Journalists,"A Dalit journalist, Sanjay Ambedkar, was allegedly assaulted by PVR staff while attempting to take audience reviews of the film Phule in Prayagraj. The incident, captured on video, has gone viral on social media, sparking outrage and demands for strict action against those involved.",,,,
Arrests,UP: Seven Muslims arrested in Sambhal for posters calling for boycott of Israeli products,Uttar Pradesh,2025,4/21/2025,"Sambhal Police on Sunday said they have arrested seven people in connection with posters bearing ‘Free Gaza, Free Palestine’ messages appearing on the walls of shops in Narauli town. The poster calls for a boycott of Israeli products while encouraging people to buy Indian products.
Across the world, people are boycotting businesses that profit from the genocide in Gaza that has killed at least 51,000 Palestinians while blocking all aid into the besieged enclave.
Baniyather Station House Officer Ramveer Singh told PTI that the police had launched a probe and identified the seven individuals based on CCTV camera footage.
Additional information was gathered from the owners of the shops on whose walls the posters appeared.
Read More"
Internet Control,Karnataka High Court Directs Union Govt To Take Steps For Blocking ‘Proton Mail’ In India,Karnataka,2025,4/29/2025,"The Karnataka High Court on Tuesday directed the Union of India to initiate process to block Proton Mail in India. A single judge, Justice M Nagaprasanna allowed the petition filed by M Moser Design Associated India Pvt Ltd, seeking a direction to the Union Government to take such steps as are necessary to ban the use of Proton Mail in India.
Read More"
Lawfare,"Day after FIR against Neha Rathore, professor Madri Kakoti, known as satirist Dr Medusa, booked for ‘sedition’ on ABVP leader’s complaint",Uttar Pradesh,2025,4/28/2025,
"Lawfare – National Security, Others","University of Lucknow assistant professor Madri Kakoti, known as satirist Dr Medusa online, has been booked for her social media posts on the Pahalgam attack.",,,,
