Category,Title,State,Year,Date,Description
Killings – Journalists,"Salman Ali Khan, a 35-year-old journalist working for a local YouTube channel was shot dead in Madhya Pradesh’s Rajgarh district at night, on Tuesday, 17 September 2024. Khan was associated with a local YouTube channel, Dastak News, for the past few years.",,,,
Killings,Dainik Bhaskar journalist Navin Nischal killed in Bihar,Bihar,2018,3/25/2018,
Killings – Journalists,"In March, two journalists – Navin Nischal and his colleague Vijay Singh, working for Dainik Bhaskar – were killed on the spot as an SUV rammed their bike in Bhojpur district of Bihar. A local leader Mohammad Harshu and his son Dabloo, are prime suspects, according to an FIR lodged by Singh’s brother.",,,,
Attacks,Life Threatening Attack on Uttarakhand Journo,Uttarakhand,2024,9/3/2024,"Yogesh Dimri’s small digital channel, Aanwala News, was in the forefront of exposing the liquor and drug mafia in the hill state.
Dimri
New Delhi: The Delhi Union of Journalists (DUJ) has condemned the “life-threatening” attack on Uttarakhand-based journalist Yogesh Dimri, whose small digital channel, Aanwala News, was in the forefront of exposing the liquor and drug mafia in the hill state. Dimri is also know for his “bold reporting” in the Ankita Bhandari murder case, said DUJ in a statement.
In a statement, DUJ demanded an immediate inquiry and adequate compensation and protection for Dhimri.
Dimri, who hails from Rishikesh, is seriously injured and was admitted to AIIMS Rishikesh by some of his journalist colleagues after the attack, allegedly by the liquor mafia, according to a report in Garhwal Post. Some videos of the attack have gone viral on social media. The attack on Dimri was condemned by various journalist unions and associations. Journalists have also appealed to the Chief Minister Puskhar Singh Dhami as well as DG Information, Banshidhar Tiwari to provide financial aid for Dimri’s treatment.
The DUJ statement also expressed its shock at the Yogi Adityanath government’s new Digital Media Policy in Uttar Pradesh.
Read the full statement below:
DUJ Condemns Life Threatening Attack on Uttarakhand Journo
The Delhi Union of Journalists condemns the life threatening attack on Uttarakhand based journalist Yogesh Dimri, whose small digital channel Aanwala News has been in the forefront of exposes about the drug and liquor mafia operating in the state. Dhimri is also known for his bold reportage of the Ankita Bhandari rape and murder case. The attack left him badly injured and he is in hospital. A video of the attack has become viral. We demand an immediate inquiry and adequate compensation and protection for Dhimri.
Read More"
Internet Control,Internet suspended in Manipur for five days amid student protests,Manipur,2024,9/10/2024,"Manipur’s Home Department has suspended internet services across the state for five days due to escalating student protests. The shutdown is intended to prevent the spread of misinformation that could exacerbate the situation. The Manipur government announced a five-day suspension of internet services, including mobile data and broadband, effective from 3 PM on September 10 to 3 PM on September 15.
Read More"
Lawfare,SC quashes HC order against The Shillong Times,Meghalaya,2023,4/2/2025,
"Lawfare – Contempt of Court, Journalists","NEW DELHI, April 2: The Supreme Court of India has quashed a contempt proceeding against The Shillong Times drawn by the High Court of Meghalaya in 2019.",,,,
Attacks,Unnao reporter ‘shot at’ months after complaining of threats from land mafia,Uttar Pradesh,2023,6/26/2023,"Police, who have recovered bullet cartridges at the spot where Mannu Awasthi was shot at, said they were awaiting a complaint from his family to lodge an FIR.
In March, Awasthi had submitted a complaint to Unnao Superintendent of Police Siddharth Shankar Meena and other senior officers, alleging there was a threat to his life by four alleged members of the land mafia. (Express)
Three months after a journalist in Uttar Pradesh’s Unnao district said he was being threatened by members of the land mafia, he was injured in a suspected shooting incident on Saturday night. On Sunday morning, he was said to be in stable condition.
Mannu Awasthi (25) was riding his scooter in an area under the Kotwal police station limits at around 10 pm when the incident took place. He was taken to the district hospital with injuries on his right shoulder. From there, he was referred to a hospital in Kanpur.
Read More"
Lawfare,Big relief for academic Ashok Swain: Delhi High Court sets aside govt’s order cancelling OCI Card (update to 2023),Delhi,2023,7/30/2023,"The Delhi High Court on March 28 granted relief to academic Ashok Swain and set aside Centre’s decision to cancel his Overseas Citizenship of India (OCI) card, reported Bar and Bench.
The bench of Justice Sachin Datta delivered the judgment, stating that the order was annulled. However, the respondents were granted the freedom to issue a fresh show cause notice.
Ashok Swain, a resident of Sweden, had contested the cancellation of his OCI card and approached the High Court to challenge the order, which he described as a non-speaking one, reported ANI.
According to a report, the contested order, issued on 30 July 2023, came after a coordinated bench had previously annulled a similar directive on 10 July 2023, which had also revoked Swain’s OCI card.
Read More"
Lawfare,Delhi High Court backs influencers’ right to fact-based criticism,Delhi,2025,4/28/2025,"The Delhi High Court ruled that social media influencers can criticise brands if their statements are backed by scientific evidence. Dismissing San Nutrition’s plea against negative whey protein reviews, the Court upheld the right to satire, hyperbole, and fair commentary under free speech, balancing consumer interests and business reputations.
The Delhi High Court on Monday, April 28th, ruled that social media influencers are permitted to make critical statements against consumer brands, provided such statements are backed by scientific evidence. The Court made this observation while rejecting San Nutrition Private Limited’s plea for an interim order to restrain four influencers from publishing negative reviews of its whey protein products.
Justice Amit Bansal, presiding over the matter, held that placing restrictions on the freedom of speech and expression before a full trial would be unreasonable. “Reasonable criticism, comment and parody is largely protected within the right to free speech under the Constitution,” the Court said.
It further noted that hyperbole, exaggerated speech, and parody do not entitle a party to interim relief, and restricting such speech would deprive the public of vital information, particularly concerning health.
San Nutrition had approached the Court against influencer Arpit Mangal, alleging that his remarks about their whey protein products were disparaging and defamatory. The Court was tasked with examining whether such influencer commentary amounted to defamation, disparagement, or trademark infringement, and to determine the scope of freedom of speech in this context.
Recognising the constitutional significance of the case, the Court invited submissions from Advocates Aditya Gupta and Varun Pathak, representing Google and Meta respectively, as amici curiae. The amici emphasised that cases like these typically engage three causes of action: defamation, disparagement, and trademark infringement, each with distinct legal standards.
Read More"
Lawfare,Delhi HC refuses to stay order asking Wikipedia to remove alleged defamatory description of ANI,All India,2025,4/1/2025,
"Lawfare – General, Others","The operator of Wikipedia has been ordered to remove statement deemed defamatory by Delhi High Court from the page of a domestic news agency it hosts, the latest such directive to the popular online encyclopedia.",,,,
Lawfare,Karnataka HC quashes case over Jain University skit with derogatory portrayal of Ambedkar (update on 2023 case),Karnataka,2025,3/2/2025,"A group of students had performed a skit featuring a man from a lowered caste background attempting to date a dominant caste woman, making controversial wordplays including altering Ambedkar’s name to “Beer Ambedkar.”
The Karnataka High Court has quashed criminal proceedings against seven students and two faculty members of Jain (Deemed-to-be) University’s Centre for Management Studies (CMS), over a skit they performed during a college festival, which was allegedly derogatory towards BR Ambedkar and Dalit communities. The case, based on a complaint filed by the Social Welfare Department, accused the participants of promoting caste discrimination and violating laws related to hate speech and atrocities against Scheduled Caste (SC) and Scheduled Tribe (ST) communities.
Justice SR Krishna Kumar, in his order, ruled that the charges under sections 153-A (promoting enmity between different groups), 149 (unlawful assembly), and 295-A (deliberate and malicious acts intended to outrage religious feelings) of the Indian Penal Code (IPC), as well as sections 3(1)(r)(s) and (v) of the Scheduled Castes and Scheduled Tribes (Prevention of Atrocities) Act, 1989, did not hold up under legal scrutiny. The court said the necessary elements constituting these offences were absent, particularly as the skit did not appear to have been performed with intent to insult or harm any specific community.
Read More"
Censorship,Jamia Millia Islamia students protest against disciplinary action and crackdown on campus democracy,Delhi,2025,2/11/2025,
Censorship – Academia,"Despite power cuts, locked washrooms, and a campus shutdown, Jamia students remain steadfast in their protest against administrative repression.",,,,
Censorship,Karnataka High Court Quashes FIR Against Journalist Rahul Shivshankar Over Tweet On Religious Minorities Fund Allocation,Karnataka,2025,3/17/2025,"The Karnataka High Court on Monday (March 17) allowed TV journalist Rahul Shivshankar’s plea seeking quashing of an FIR registered against him for his tweet about the State government’s allocation of funds for welfare of religious minorities.Justice M Nagaprasanna while pronouncing the order said that the petition has been allowed and the FIR has been quashed.
Read More"
Censorship,"Bombay HC: Suspension of Dalit PhD student by TISS ‘not outcome of discrimination’, dismisses plea",Maharashtra,2025,3/16/2025,
Censorship – Academia,"The plea filed by Ramadas K S sought to set aside a report by the empowered committee of TISS, which recommended his suspension, claiming that the panel had conducted an arbitrary inquiry.",,,,
Harassment,US journalist Raphael Satter sues Indian government after losing his overseas citizenship,Delhi,2023,12/30/2023,
Harassment – Journalists,"A US journalist has taken the Indian government to court after his Indian overseas citizenship was unilaterally cancelled, after the publication of a story critical of a prominent Indian businessman.",,,,
Arrests,"7 months after video of farmer praising KCR, Telangana journalist held over 4 FIRs",Telangana,2024,10/10/2024,"Gowtham Pothagoni, a journalist with digital news portal Telugu Scribe, has been arrested and charged with “attempting to create political tensions and promoting disharmony among the public” and “insulting Telangana government and Chief Minister Revanth Reddy”.
The arrest on Monday comes seven months after the journalist posted a video on his X account where a farmer expressed his resentment towards the Telangana government, led by the Congress party. The arrest was based on four FIRs filed against Gowtham in September, three of which were solely based on this video. It’s unclear why the complaints were filed in September over a video that went viral in March.
Read More"
Arrests,"Mahesh Langa, Gujarat-based journalist with The Hindu, arrested in alleged GST fraud case",Gujarat,2024,10/9/2024,"Mahesh Langa, a Gujarat-based senior assistant editor at The Hindu, was on Tuesday morning placed under arrest along with three others by the Detection of Crime Branch (DCB). The development comes a day after 13 firms and their proprietors were booked for alleged input tax credit (ITC) fraud, based on a complaint filed by the Directorate General of GST Intelligence (DGGI).
Read More"
Killings,"Shashikant Warishe, a 48-year-old journalist from Ratnagiri, Maharashtra, mowed down.",Maharashtra,2023,2/6/2023,
Killings – Journalists,"In a shocking incident, on February 6, 2023, journalist Shashikant Warishe was mowed down and crushed by a vehicle allegedly driven by Pandharinath Amberkar, a local land-dealer and accused in several land grab cases in the controversial Barsu refinery in the western Konkan region of Maharashtra, barely a few hours after he published a report in Marathi newspaper Mahanagari Times about his links with Prime Minister Narendra Modi, Maharashtra Chief Minister Eknath Shinde and Deputy Chief Minister Devendra Fadnavis.",,,,
Harassment,"Journalist Aniru Asokan, a reporter with the Madhyamam daily, asked to submit his mobile phone as part of an investigation",Kerala,2024,12/21/2024,
Harassment – Journalists,"A notice was reportedly served to journalist Aniru Asokan, a reporter with the Madhyamam daily, demanding he submit his mobile phone as part of an investigation into a July 28 report on an alleged data leak at the state Public Service Commission (PSC). Following this, the Kerala Union of Working Journalists (KUWJ) staged protest marched on Tuesday, November 24, condemning the Kerala police for demanding that a journalist submit his mobile phone as part of an investigation.",,,,
Lawfare,"Delhi Police filed an FIR against human rights activist, Nadeem Khan",Delhi,2024,11/30/2024,
Harassment – Journalists | Lawfare – General – Journalists,"Nadeem Khan, the National Secretary of the Association for Protection of Civil Rights (APCR) and a well-known advocate for minorities and social justice, was targeted in a dramatic and illegal raid on November 30, 2024, when four Delhi Police officers, including the SHO of Shaheen Bagh Police Station, arrived at a private residence in Bangalore where Khan was staying. Without any arrest warrant or formal notice, the officers attempted to detain Khan, coercing him to travel with them to Delhi for questioning under an FIR filed that very afternoon.",,,,
Censorship,Saffron Policing at Hyderabad Book Fair,Telangana,2024,12/29/2024,
Censorship – Academia,"At the Hyderabad Book Fair held from December 19-29, 2024, a person with saffron leanings raised objections on sale of a book titled “Tirupati Balaji: A Buddhist Shrine” at the stall set up by Veeksahanam and was of the view that anti-Hindu books were being sold in the stall. Veekshanam publishes a monthly magazine in Telugu on people’s issues and runs a YouTube channel named “Mahua Media”. The stall had among its collections books related to literature, research, history, science, education, society, politics and agriculture.",,,,
Censorship,"CBFC’s Kryptonite: Superman may save the world, but smooching is off limits in India",Applicable Across India,2025,7/15/2025,
Censorship – The Arts,"James Gunn’s Superman was set to soar high in Indian cinemas this month. Instead, audiences were left puzzled when the superhero’s tender moments vanished mid-scene. India’s Central Board of Film Certification (CBFC) cut two kissing scenes, including a much-talked-about 33-second mid-air embrace, calling them “overly sensual”. These edits were made so the film could get a UA (13+) rating before its 7 July certification.",,,,
Lawfare,FIR against UP school teacher Rajneesh Gangwar for reciting poem allegedly critical of Kanwar Yatra,Uttar Pradesh,2025,7/15/2025,
"Lawfare – General, Others",A viral video showed the person reciting a poem which said that one should not embark on the pilgrimage and instead ‘light the lamp of knowledge’.,,,,
Killings,"Journalist Ch. Naresh attacked by sword in Malkangiri, dies",Odisha,2025,7/12/2025,
Killings – Journalists,"In a tragic incident, a journalist was killed brutally by some miscreants on Saturday night. The incident happened in Muraliguda village under Motu police limits in Malkangiri district.",Assam,2025,7/11/2025,
Lawfare – National Security (Journalists),"On July 11, 2025, an FIR was registered by the Morigaon police in Assam based on a complaint by a local BJP leader with respect to an article on the website, ‘IAF Lost Fighter Jets to Pak Because of Political Leadership’s Constraints’: Indian Defence Attache’, published on June 28, 2025. The article dealt with a statement made by India’s defence attache to Indonesia, Captain (Indian Navy) Shiv Kumar, who acknowledged at a seminar in Indonesia that the Indian Air Force lost fighter jets to Pakistan on the night of May 7, 2025, during Operation Sindoor, because of the “constraint given by the political leadership to not attack the military establishment or their air defences”.",,,,
Threats,“We will cut off your hands”: CPI(M) workers’ threat to MediaOne editor draws Kerala journalist union’s ire,Kerala,2025,7/11/2025,
Threats – Journalists,"The Kerala Union of Working Journalists (KUWJ) State Committee has strongly condemned the provocative slogans raised by CPI(M) workers in Wandoor, which included a threat to amputate the hand of MediaOne Managing Editor C Dawood.",,,,
Censorship,‘Offending’ parts of ‘Udaipur Files’ taken down: CBFC to HC,Applicable Across India,2025,7/9/2025,
Censorship – The Arts,"“The Central Board of Film Certification (CBFC) on Wednesday told the Delhi high court that certain offending portions of the movie “Udaipur Files”, relating to the 2022 brutal murder of a tailor Kanhaiya Lal, had been taken down.",,,,
Threats,Heightened Security at ABN Andhra Jyothi Offices Amid Tensions in Hyderabad,Andhra Pradesh,2025,7/7/2025,
Threats – Journalists,Tensions flared outside the ABN Andhra Jyothi offices as a significant police presence was observed on Monday. The deployment follows a controversial editorial by Radha Krishna and subsequent protests by BRS party leaders.,Applicable Across India,2025,7/5/2025,
Censorship – News Media/Documentaries,"“The official X account of international news agency Reuters has been restricted in India following a “legal demand.” So far, Reuters has not issued a statement clarifying the reason behind the blocking of its account.",,,,
Killings,"Vehicle Driver, S. Premjit Singh, who was ferrying newspapers and media personnel shot dead by unknown gunmen",Manipur,2025,7/4/2025,
Killings – Others,"Tensions continue to rise in Manipur after the Gwaltabi incident 2024, in which a civilian was shot dead in Ukhrul district. While political leaders remain silent, journalists across the state are preparing to stage a sit-in protest. They demand answers and accountability from the government over the disturbing silence surrounding the incident.",,,,
Attacks,Pune journalist Sneha Barve brutally attacked and beaten till she was unconscious,Maharashtra,2025,7/4/2025,
Attacks – Journalists,"In a heinous attack in broad daylight, journalist Sneha Barve was beaten with a wooden rod till she became unconscious while she was reporting on illegal construction activity in a riverbed in a town near Pune on July 4, 2025. Till the first week of September 2025, the main accused, Pandurang Sakharam Morde, a local businessperson with political connections, had not been arrested.",,,,
"Censorship, Lawfare",Freedom Of Speech Doesn’t Extend To Insulting The Prime Minister: Allahabad High Court,Uttar Pradesh,2025,7/3/2025,
"Censorship – Social Media, Lawfare – General, Others","The Allahabad High Court recently denied bail to a man accused of sharing edited social media posts that mocked and disrespected Prime Minister Narendra Modi, stating that the constitutional right to free speech does not include the liberty to insult the nation’s Prime Minister.",,,,
Censorship,CBFC revising committee rejects certification to JSK – Janaki vs State of Kerala,Applicable Across India,2025,6/27/2025,
Censorship – The Arts,"Filmmakers have been asked to change the title of the film as well as the name of the protagonist, Janaki, another name of Hindu goddess Sita",,,,
Censorship,"Curriculum cut or censorship? DU Panel sparks controversy after dropping PG papers on Islam, Pakistan and China",Delhi,2025,6/25/2025,
Censorship – Academia,"A Delhi University panel’s decision to drop proposed postgraduate Political Science papers on Islam, Pakistan, and China has failed to find consensus among the members.",,,,
Censorship,“We just got banned from world’s largest democracy”: Instagram page The Savala Vada withheld in India,Applicable Across India,2025,6/21/2025,
Censorship – Social Media,"The Instagram account of The Savala Vada, a satirical meme page with over eighty thousand followers known for its sardonic, dark humour and sarcastic critiques of the Union government, has been withheld in India.",,,,
Censorship,CBFC orders Hindi film ‘Sitaare Zameen Par’ to include PM Modi quote,Applicable Across India,2025,6/19/2025,
Censorship – The Arts,"The Central Board of Film Certification (CBFC) directed the makers of Aamir Khan’s upcoming film Sitaare Zameen Par to make five changes/suggestions to the film, among which was the addition of a quote by Prime Minister Narendra Modi referencing the year 2047 in the opening disclaimer, according to documents seen by HT.",,,,
"Arrests, Lawfare",Journalist Amir Hamza arrested while covering Agnipath protests and three others detained,Bihar,2025,6/19/2025,
"Arrests – Journalists, Lawfare – Detention, Journalists","Four journalists covering the Agnipath protests in Patna were detained by police after one of them, Amir Hamza, was roughed up and shoved by a police officer. Hamza, a journalist working with a newschannel on Youtube ‘The Activist’, was arrested and is yet to get bail.",,,,
Lawfare,Author Mrityunjay Sharma slapped with ₹5 crore defamation notice by Sadhu Yadav over explosive allegations,Jharkhand,2025,6/18/2025,
"Lawfare – Defamation, Journalists","Mrityunjay Sharma, Ranchi-based author of Broken Promises, has been served a ₹5 crore defamation notice by Sadhu Yadav, brother-in-law of RJD chief Lalu Prasad Yadav and a once-notorious figure in Bihar’s political history.",,,,
Censorship,Massive police crackdown across Mumbai to crush Protest to Condemn Israeli Genocide of Gaza,Maharashtra,2025,6/18/2025,
Censorship – Protests/Meetings,"In the early hours of the morning, Mumbai police came to the houses of various Political Party leaders & Social Activists to detain them to prevent a peaceful protest against the genocide in Gaza that is scheduled to be held at the Azad Maidan in Mumbai today at 3.30 pm. The protests were part of the National Call issued by the Left Parties and were held across the country, but it’s only in Mumbai that the state decided to crackdown.Those detained include Com. Prakash Reddy (CPI), Meraj Siddiqui (Samajwadi Party, Com. Raju Korde (PWP), Com. Shyam Gohil (CPI-ML Liberation), Feroze Mithiborwala (India Palestine Solidarity Forum), Junaid Khan (PWP), and many Left Party cadres from across the city.",,,,
Censorship,Mamata Banerjee’s Censorship Efforts Continue as Bengal Police Asks X to Take Down Manjul’s Cartoons on CM,West Bengal,2025,6/18/2025,
Censorship – The Arts,"The West Bengal Cyber Crime Wing has asked for the removal of two of Manjul’s cartoons, posted back in 2019, alleging they violated Indian law.",,,,
Censorship,"Rule of law must prevail, Supreme Court tells Karnataka on Thug Life screening",Karnataka,2025,6/17/2025,
Censorship – The Arts,"The Supreme Court made it clear on Tuesday (June 17, 2025) that the rights of filmmakers and theatre owners to release movies cannot be curtailed by threats of arson and violence while underscoring that the Karnataka government must ensure that Kamal Haasan’s Thug Life is screened across the State.",,,,
Killings,"Influencer Kanchan Kumari strangled, left in car by radical group over ‘objectionable’ content, say Punjab police",Punjab,2025,6/10/2025,
Killings – Others,"The Punjab Police have cracked the blind murder case of 30-year-old social media influencer Kanchan Kumari, popularly known as Kamal Kaur Bhabhi, with the arrest of two nihangs who allegedly killed her as part of a “moral policing” act.",,,,
Lawfare,Churu: FIR slapped on local journalist Akhter Mugal who recorded DSP hitting lady constable on the back,Rajasthan,2025,6/9/2025,
"Lawfare – General, Journalists","“After the video of the Churu DSP slapping a woman constable on the back to catch her attention went viral, an FIR has now been lodged against journalist Akhter Mugal who recorded the incident.",Kerala,2025,6/9/2025,
"Lawfare – Defamation, Journalists","In June 2025, an FIR was lodged against journalist Nandakumar TP under the provisions of the Bharatiya Nyaya Sanhita for offences of outraging a woman’s modesty, intimidation and intent to cause reputational harm, and dissemination of obscene content electronically. He was also booked under Section 67 of the Information Technology Act that penalises publication or transmission of obscene material in electronic form.",,,,
Arrests,Senior journalist Kommineni Srinivasa Rao arrested after controversial Sakshi TV debate,Andhra Pradesh,2025,6/9/2025,
